{
  "id": "golden-defeat-002",
  "category": "defeat",
  "description": "敌零血倒地：绝不再攻击一具尸体",
  "setup": {
    "stateHash": "34725cf5d9dd5f76",
    "serialized": "{\"world\":{\"props\":{\"hiddenRefs\":[],\"aiCombatDamageRef\":1},\"agents\":{\"g:ai\":{\"kind\":\"ai\",\"knowledgeVersion\":\"ks:ai\"}},\"knowledge\":{},\"decisions\":{},\"intents\":{},\"attachments\":{},\"turn\":{\"scheduleId\":\"sched:round\",\"phaseIndex\":0,\"phaseEnteredAt\":0},\"rng\":{},\"ruleCircuitState\":{},\"log\":[],\"logSeq\":0,\"deferredEffects\":[],\"deferredSeq\":0},\"defs\":{},\"nodes\":{\"n:hero-a\":{\"def\":\"d:room\",\"kind\":\"node\"},\"n:enemy-a\":{\"def\":\"d:room\",\"kind\":\"node\"},\"n:far-a\":{\"def\":\"d:room\"}},\"links\":{},\"entities\":{\"e:hero\":{\"def\":\"d:fighter\",\"kind\":\"entity\",\"node\":\"n:hero-a\",\"props\":{\"vitality\":5,\"initiative\":3}},\"e:enemy\":{\"def\":\"d:fighter\",\"kind\":\"entity\",\"node\":\"n:enemy-a\",\"props\":{\"vitality\":0,\"initiative\":0},\"tags\":[\"tag:downed\"]}},\"items\":{},\"containers\":{}}"
  },
  "expect": {
    "shouldSelect": "a:eternal-sleep"
  },
  "isGolden": true,
  "source": "initial"
}
