{
  "id": "golden-resource-001",
  "category": "resource",
  "description": "AP>0 时不压零自断后路",
  "setup": {
    "stateHash": "d7b1b858304790cb",
    "serialized": "{\"world\":{\"props\":{\"hiddenRefs\":[],\"aiCombatDamageRef\":1},\"agents\":{\"g:ai\":{\"kind\":\"ai\",\"knowledgeVersion\":\"ks:ai\"}},\"knowledge\":{},\"decisions\":{},\"intents\":{},\"attachments\":{},\"turn\":{\"scheduleId\":\"sched:round\",\"phaseIndex\":0,\"phaseEnteredAt\":0},\"rng\":{},\"ruleCircuitState\":{},\"log\":[],\"logSeq\":0,\"deferredEffects\":[],\"deferredSeq\":0},\"defs\":{},\"nodes\":{\"n:hero-a\":{\"def\":\"d:room\",\"kind\":\"node\"},\"n:enemy-a\":{\"def\":\"d:room\",\"kind\":\"node\"},\"n:far-a\":{\"def\":\"d:room\"}},\"links\":{},\"entities\":{\"e:hero\":{\"def\":\"d:fighter\",\"kind\":\"entity\",\"node\":\"n:hero-a\",\"props\":{\"vitality\":4,\"initiative\":3}},\"e:enemy\":{\"def\":\"d:fighter\",\"kind\":\"entity\",\"node\":\"n:enemy-a\",\"props\":{\"vitality\":3,\"initiative\":2}}},\"items\":{},\"containers\":{}}"
  },
  "expect": {
    "shouldNotSelect": [
      "a:overcharge"
    ]
  },
  "isGolden": true,
  "source": "initial"
}
