{
  "id": "golden-sustain-001",
  "category": "sustain",
  "description": "自身残血（1，致死窗口）→ 应优先保命",
  "setup": {
    "stateHash": "badc7da8266b678f",
    "serialized": "{\"world\":{\"props\":{\"hiddenRefs\":[],\"aiCombatDamageRef\":1},\"agents\":{\"g:ai\":{\"kind\":\"ai\",\"knowledgeVersion\":\"ks:ai\"}},\"knowledge\":{},\"decisions\":{},\"intents\":{},\"attachments\":{},\"turn\":{\"scheduleId\":\"sched:round\",\"phaseIndex\":0,\"phaseEnteredAt\":0},\"rng\":{},\"ruleCircuitState\":{},\"log\":[],\"logSeq\":0,\"deferredEffects\":[],\"deferredSeq\":0},\"defs\":{},\"nodes\":{\"n:hero-a\":{\"def\":\"d:room\",\"kind\":\"node\"},\"n:enemy-a\":{\"def\":\"d:room\",\"kind\":\"node\"},\"n:far-a\":{\"def\":\"d:room\"}},\"links\":{},\"entities\":{\"e:hero\":{\"def\":\"d:fighter\",\"kind\":\"entity\",\"node\":\"n:hero-a\",\"props\":{\"vitality\":1,\"initiative\":3}},\"e:enemy\":{\"def\":\"d:fighter\",\"kind\":\"entity\",\"node\":\"n:enemy-a\",\"props\":{\"vitality\":4,\"initiative\":2}}},\"items\":{},\"containers\":{}}"
  },
  "expect": {
    "shouldSelect": "a:heal"
  },
  "isGolden": true,
  "source": "initial"
}
